id,author,title,genre,acts,prologue,prose_vers,musique_danse_machine,date_de_creation
4999,Chamfort (Sébastien-Roch-Nicolas de),Jeune indienne (La),comédie,1,FALSE,vers,FALSE,
5531,Fagan (Barthélemy-Christophe),Joconde,comédie,1,FALSE,prose,TRUE,
4958,Scarron (Paul),"Jodelet, ou le Maître valet",comédie,5,FALSE,vers,FALSE,
5532,Duché de Vancy (Joseph-François),Jonathas,tragédie,3,FALSE,vers,FALSE,
5533,"Genest (Charles-Claude, abbé)",Joseph,tragédie,5,FALSE,vers,FALSE,
5134,Regnard (Jean-François),Joueur (Le),comédie,5,FALSE,vers,FALSE,
5776,Champmeslé (Charles Chevillet dit),Joueurs (Les),comédie,5,FALSE,vers,FALSE,
5618,Du Fresny (Charles),Joueuse (La),comédie,5,FALSE,prose,TRUE,
5135,Aude (Joseph),Journaliste des ombres ou Momus au Champ-Élysées (Le),pièce héroï-nationale,1,FALSE,vers,FALSE,
5534,"Boyer (Claude, abbé)",Judith,tragédie,5,FALSE,vers,FALSE,
5535,Péchantrés (Nicolas de),"Jugurtha, roi de Numidie",tragédie,5,FALSE,vers,FALSE,
4961,Saint-Foix (Germain-François Poullain de),Julie ou l'Heureuse épreuve,comédie,1,FALSE,prose,FALSE,
4959,Denon (Dominique-Vivant),Julie ou le Bon père,comédie,3,FALSE,prose,FALSE,10/20/1746
4960,Marin (François-Louis-Claude),Julie ou le Triomphe de l'amitié,comédie,3,FALSE,prose,FALSE,14 JUIN 1769
5056,Lebeau de Schosne (Augustin-Théodore-Vincent),L'Assemblée,comédie,1,FALSE,vers,FALSE,3 MARS 1762
5054,André-Murville (Pierre-Nicolas),Lanval et Viviane ou les Fées et les chevaliers,comédie héori-féérie,5,FALSE,vers,FALSE,
5653,Bernard (Catherine),"Laodamie, reine d'Epire",tragédie,5,FALSE,vers,FALSE,
5700,Anonyme,Laquais fille (Le),comédie,,FALSE,,FALSE,
5057,Oisemont (d'),Laurette,comédie,3,FALSE,vers libres,FALSE,
5200,Legrand (Marc-Antoine),Le Temps passé ou le Triomphe du temps passé (Le),comédie,1,FALSE,prose,TRUE,
5136,Regnard (Jean-François),Légataire universel (Le),comédie,5,FALSE,vers,FALSE,
5137,Marivaux (Pierre de),Legs (Le),comédie,1,FALSE,prose,FALSE,
5271,Marivaux (Pierre de),Les Fausses confidences,comédie,3,FALSE,vers,FALSE,
5275,Demoustier (Charles-Albert),Les Femmes,comédie,4,FALSE,vers,FALSE,
5296,Lourdet de Santerre (Jean-Baptiste),Les Quatre sœurs,comédie,3,FALSE,vers libres,FALSE,
5000,Harny de Guerville,Liberté conquise ou le Despotisme renversé (La),drame patriotique,5,FALSE,prose,FALSE,23 MAI 1793
5348,Dubois-Fontanelle (Joseph-Gaspard),Loredan,drame,4,FALSE,vers,FALSE,
5619,Dancourt (Florent Carton dit),Loterie (La),comédie,1,FALSE,prose,FALSE,
5351,Ronsin (Charles-Philippe),"Louis XII, Père du peuple",tragédie,3,FALSE,vers,FALSE,
5352,Lemercier (Népomucène-Louis),Lovelace,comédie,5,FALSE,vers,FALSE,
5793,Fagan (Barthélemy-Christophe),Lucas et Perrette,comédie,1,FALSE,prose,TRUE,
5353,Arnault (Antoine Vincent),Lucrèce,tragédie,5,FALSE,vers,FALSE,
5794,Caux de Montlebert (Gilles de),Lysimachus,tragédie,5,FALSE,vers,FALSE,4 MAI 1792
5355,Ducis (Jean-François),Macbeth,tragédie,5,FALSE,vers,FALSE,
5282,La Motte (Antoine Houdar de),Machabées (Les),tragédie,5,FALSE,vers,FALSE,
5795,Dancourt (Florent Carton dit),Madame Artus,comédie,5,FALSE,vers,FALSE,6 MARS 1722
5001,Autreau (Jacques),Magie de l'Amour (La),comédie-pastorale,1,FALSE,vers libres,TRUE,
5138,La Motte (Antoine Houdar de),Magnifique (Le),comédie,2,FALSE,prose,TRUE,
5357,"La Noue (Jean-Baptiste Sauvé de La Noue, dit)",Mahomet second,tragédie,5,FALSE,vers,FALSE,
5796,Chateaubrun (Jean-Baptiste Vivien de),Mahomet second,tragédie,5,FALSE,vers,FALSE,
5139,Laus de Boissy (Louis de),Maire ou le Pouvoir de la loi (Le),comédie patriotique,1,FALSE,prose,FALSE,
5002,Dancourt (Florent Carton dit),Maison de campagne (La),comédie,1,FALSE,prose,FALSE,
5003,Mercier (Louis-Sebastien),Maison de Molière (La),comédie,4,FALSE,prose,FALSE,
5140,Molière (Jean-Baptiste Poquelin dit),Malade imaginaire (Le),comédie-ballet,3,TRUE,vers,TRUE,
5620,Du Fresny (Charles),Malade sans maladie (La),comédie,5,FALSE,prose,FALSE,
5141,Dorat (Claude-Joseph),Malheureux imaginaire (Le),comédie,5,FALSE,vers,FALSE,
5358,Le Blanc de Guillet (Antoine),"Manco Capac, premier Inca du Pérou",tragédie,5,FALSE,vers,FALSE,
5004,Rochon de Chabannes (Marc-Antoine-Jacques),Manie des arts ou la Matinée à la mode (La),comédie,1,FALSE,prose,FALSE,12 JUIN 1763
5359,La Fosse (Antoine de),Manlius Capitolinus,tragédie,5,FALSE,vers,FALSE,
5142,Chamfort (Sébastien-Roch-Nicolas de),Marchand de Smyrne (Le),comédie,1,FALSE,prose,FALSE,
5701,Anonyme,Maréchal médecin (Le) ou Les Houssards ou Le Médecin de Mantes,comédie,1,FALSE,prose,FALSE,
5702,Allainval (Léonor-Jean-Christine Soulas d'),Mari curieux (Le),comédie,1,FALSE,prose,TRUE,
5143,Carbon de Flins Des Oliviers (Claude-Marie-Louis-Emmanuel),Mari directeur ou le Déménagement du couvent (Le),comédie,1,FALSE,vers,FALSE,
5703,Audierne (Jacques),Mari égaré (Le),comédie,1,TRUE,prose,FALSE,
5144,Dancourt (Florent Carton dit),Mari retrouvé (Le),comédie,1,FALSE,prose,TRUE,
5145,Montfleury (Antoine Jacob dit),Mari sans femme (Le),comédie,5,FALSE,vers,TRUE,
5146,Lemonnier (Pierre-René),Mariage clandestin (Le),comédie,3,FALSE,vers libres,FALSE,
5704,Donneau de Vizé (Jean),Mariage de Bacchus et d'Ariane (Le),comédie héroïque,3,TRUE,vers,TRUE,
5147,Beaumarchais (Pierre-Augustin Caron de),Mariage de Figaro ou la Folle journée (Le),comédie,5,FALSE,prose,FALSE,
5705,Montfleury (Antoine Jacob dit),Mariage de rien (Le),comédie,1,FALSE,vers,TRUE,
5148,Du Fresny (Charles),Mariage fait et rompu (Le),comédie,3,FALSE,vers,FALSE,
5706,Poisson (Philippe),Mariage fait par lettre de change (Le),comédie,1,FALSE,vers,TRUE,
5149,Molière (Jean-Baptiste Poquelin dit),Mariage forcé (Le),comédie,1,FALSE,prose,TRUE,
5150,Cailhava de L'Estandoux (Jean-François),Mariage interrompu (Le) ou La Fille supposée,comédie,3,FALSE,vers,FALSE,
5151,Bret (Antoine),Mariage par dépit (Le),comédie,3,FALSE,prose,FALSE,
5152,Brousse-Desfaucherets (Jean-Louis),Mariage secret (Le),comédie,3,FALSE,vers,FALSE,
5797,Nadal (Augustin),Mariamne,tragédie,5,FALSE,vers,FALSE,
5621,Tristan L'Hermite,Marianne (La),tragédie,5,FALSE,vers,FALSE,
5360,Imbert (Barthélemy),"Marie de Brabant, reine de France",tragédie,5,FALSE,vers,FALSE,
5707,Fagan (Barthélemy-Christophe),Marié sans le savoir (Le),comédie,1,FALSE,prose,FALSE,9 SEPT 1789
5798,Tronchin (François),"Marie Stuart, reine d'Écosse",tragédie,5,FALSE,vers,FALSE,
5799,Boursault (Edme),"Marie Stuart, reine d'Écosse ",tragédie,5,FALSE,vers,FALSE,
5283,Desforges (Pierre-Jean-Baptiste Choudard),Marins ou le Médiateur maladroit (Les),comédie,5,FALSE,vers,FALSE,
5361,Caux de Montlebert (Gilles de),Marius,tragédie,5,FALSE,vers,FALSE,30 juin 1783
5362,Arnault (Antoine Vincent),Marius à Minturnes,tragédie,3,FALSE,vers,FALSE,
5708,Anonyme,Marquis de l'industrie (Le),comédie,5,FALSE,vers,FALSE,19 MAI 1791
5622,Anonyme,Marquise imaginaire (La),comédie,1,FALSE,,FALSE,
5005,Vigée (Louis-Jean-Baptiste-Étienne),Matinée d'une jolie femme (La),comédie,1,FALSE,prose,FALSE,
5623,La Motte (Antoine Houdar de),Matrone d'Éphèse (La),comédie,1,FALSE,prose,FALSE,
5800,La Chaussée (Pierre-Claude),Maximien,tragédie,5,FALSE,vers,FALSE,
5153,Gresset (Jean-Baptiste-Louis),Méchant (Le),comédie,5,FALSE,vers,FALSE,
5777,Le Clerc de La Bruère (Charles-Antoine),Mécontents (Les),comédie,1,TRUE,vers,TRUE,
5154,Anseaume (Louis) ; Laruette (Jean-Louis),Médecin de l'amour (Le) ou Le Médecin d'amour,opéra-comique,,FALSE,vers,TRUE,
5709,Guyot de Merville (Michel),Médecin de l'esprit (Le),comédie,1,FALSE,prose,FALSE,
5710,Anonyme,Médecin de village (Le),comédie,1,FALSE,prose,TRUE,
5155,Molière (Jean-Baptiste Poquelin dit),Médecin malgré lui (Le),comédie,3,FALSE,prose,TRUE,
5156,Boissy (Louis de),Médecin par occasion (Le),comédie,5,FALSE,vers,FALSE,
5711,Boursault (Edme),Médecin volant (Le),comédie,1,FALSE,vers,FALSE,
5365,Clément (Jean Marie Bernard),Médée,tragédie,3,FALSE,vers,FALSE,
5363,Longepierre (Hilaire-Bernard de),Médée ou Médée et Jason,tragédie,5,FALSE,vers,FALSE,
5157,Destouches,Médisant (Le),comédie,5,FALSE,vers,FALSE,
5801,Deschamps (François-Michel-Chrétien),Médus,tragédie,5,FALSE,vers,FALSE,
5366,Morand (Pierre de),Mégare,tragédie,5,FALSE,vers,FALSE,
5367,La Chaussée (Pierre-Claude),Mélanide,comédie,5,FALSE,vers,FALSE,19 OCTOBRE 1748
5368,André-Murville (Pierre-Nicolas),Melcour et Verseuil,comédie,1,FALSE,vers,FALSE,MAI 1741
5369,Lemercier (Népomucène-Louis),Méléagre,tragédie,5,FALSE,vers,FALSE,8 AOUT 1785
5802,La Grange-Chancel (François-Joseph de),Méléagre,tragédie,5,FALSE,vers,FALSE,
5284,Regnard (Jean-François),Ménechmes ou les Jumeaux (Les),comédie,5,TRUE,vers et vers libres,FALSE,
5158,Corneille (Pierre),Menteur (Le),comédie,5,FALSE,vers,FALSE,4 DECEMBRE 1705
5624,Audierne (Jacques),Méprise (La),comédie,1,TRUE,prose,FALSE,
5286,Palissot de Montenoy (Charles),Méprises ou le Rival par ressemblance (Les),comédie,5,FALSE,vers,FALSE,25 avril 1754
5159,Boursault (Edme),Mercure galant ou la Comédie sans titre (Le),comédie,4,FALSE,vers,TRUE,7 juin 1762
5006,Quinault (Philippe),Mère coquette ou les Amants brouillés (La),comédie,5,FALSE,vers,FALSE,
5007,Barthe (Nicolas-Thomas),Mère jalouse (La),comédie,3,FALSE,vers,FALSE,
5625,Montfort,Mère ridicule (La),comédie,1,FALSE,,FALSE,
5803,Dancourt (Florent Carton dit),Merlin déserteur,comédie,1,FALSE,prose,FALSE,
5804,Dancourt (Florent Carton dit),Merlin la Chaconne,comédie,3,FALSE,,TRUE,
5805,"La Tuillerie (Jean-François Juvenon de La Tuillerie, dit)",Merlin peintre,comédie,1,FALSE,prose,FALSE,
5370,Voltaire (François-Marie Arouet dit),Mérope,tragédie,5,FALSE,vers,FALSE,
5008,Legrand (Marc-Antoine),Métamorphose amoureuse (La),comédie,1,FALSE,prose,FALSE,10/8/1904
5009,Yon,Métempsychose (La) ou La Métempsicose,comédie,3,TRUE,vers libres,FALSE,
5010,Piron (Alexis),Métromanie ou le Poète (La),comédie,5,FALSE,vers,FALSE,
5371,Desaudras,Minuit ou le Moment propice,comédie,1,FALSE,prose,FALSE,
5160,Molière (Jean-Baptiste Poquelin dit),Misanthrope (Le),comédie,5,FALSE,vers,FALSE,31 DECEMBRE 1791
5372,Racine (Jean),Mithridate,tragédie,5,FALSE,vers,FALSE,
5287,Saurin (Bernard-Joseph),Mœurs du temps (Les),comédie,1,FALSE,prose,TRUE,
5778,Saint-Yon (pièce attribuée à Palaprat (Jean),Mœurs du temps (Les) ou Les Façons du temps,comédie,5,FALSE,prose,FALSE,22 DECEMBRE 1760
5373,La Harpe (Jean François de),Molière à la nouvelle salle ou les Audiences de Thalie,comédie,1,FALSE,vers libres,FALSE,
5374,Fuzelier (Louis),Momus fabuliste ou les Noces de Vulcain ou Momus fabuliste ou le Mariage de Vénus et de Vulcain,comédie,1,FALSE,prose et vers libres,TRUE,12 AVRIL 1782
5375,Collin d'Harleville (Jean-François),Monsieur de Crac dans son petit castel ou les Gascons,comédie,1,FALSE,vers,TRUE,
5376,Molière (Jean-Baptiste Poquelin dit),Monsieur de Pourceaugnac,comédie-ballet,3,FALSE,prose,TRUE,4 MARS 1791
5806,Ferrier de la Martinière (Louis),Montézume dernier roi du Mexique,tragédie,5,FALSE,vers,FALSE,
5011,Legouvé (Gabriel),Mort d'Abel (La),tragédie,3,FALSE,vers,FALSE,
5632,Dancourt (Florent Carton dit),Mort d'Alcide (La),tragédie,5,FALSE,vers,FALSE,
5627,Louvet,Mort d'Alexandre (La),tragédie,5,FALSE,vers,FALSE,
5628,Belin,Mort d'Othon (La),tragédie,5,FALSE,vers,FALSE,
5629,Pellegrin (Simon-Joseph),Mort d'Ulysse (La),tragédie,5,FALSE,vers,FALSE,
5012,Voltaire (François-Marie Arouet dit),Mort de César (La),tragédie,3,FALSE,vers,FALSE,
5630,Barbier (Marie-Anne),Mort de César (La),tragédie,5,FALSE,vers,FALSE,
5013,Cubières-Palmézeaux (Michel de),Mort de Molière (La),pièce historique,3,FALSE,vers,FALSE,
5631,Péchantrés (Nicolas de),Mort de Néron (La),tragédie,5,FALSE,vers,FALSE,
5014,Corneille (Pierre),Mort de Pompée (La),tragédie,5,FALSE,vers,FALSE,
5015,Billardon de Sauvigny (Edme-Louis),Mort de Socrate (La),tragédie,3,FALSE,vers,FALSE,
5779,Boursault (Edme),Mots à la mode (Les),comédie,1,FALSE,vers,FALSE,
5161,Dancourt (Florent Carton dit),Moulin de Javelle (Le),comédie,1,FALSE,prose,TRUE,
5162,Brueys (David-Augustin de),Muet (Le),comédie,5,FALSE,prose,FALSE,
5163,Alliot,Muet par amour (Le),comédie,1,FALSE,vers,TRUE,
5288,La Harpe (Jean François de),Muses rivales ou l'Apothéose de Voltaire (Les),comédie,1,FALSE,vers libres,FALSE,
5377,Chamfort (Sébastien-Roch-Nicolas de),Mustapha et Zéangir,tragédie,5,FALSE,vers,FALSE,1e FEVRIER 1779
5807,Belin (François),Mustapha et Zéangir,tragédie,5,FALSE,vers,FALSE,1 NOVEMBRE 1776
5808,Guérin d'Estriché (Nicolas-Armand-Martial),Myrtil et Mélicerte,pastorale héroïque,3,TRUE,vers,TRUE,
5378,Dubuisson (Pierre-Ulric),Nadir ou Thamas-Kouli-Kan,tragédie,5,FALSE,vers,FALSE,
5379,"Thibouville (Henri Lambert d'Herbigny, marquis de)",Namir,tragédie,5,FALSE,vers,FALSE,31 AOUT 1780
5380,Voltaire (François-Marie Arouet dit),Nanine ou le Préjugé vaincu,comédie,3,FALSE,vers,FALSE,12 NOVEMBRE 1759
5381,Rousseau (Jean-Jacques),Narcisse ou l'Amant de lui-même,comédie,1,FALSE,prose,FALSE,16 juin 1749
5164,La Font (Joseph de),Naufrage ou la Pompe funèbre de Crispin (Le) ou Crispin brûlé,comédie,1,FALSE,vers,TRUE,18 décembre 1752
5712,Du Fresny (Charles),Négligent (Le),comédie,3,TRUE,prose,TRUE,
5713,Raisin (Jacques),Niais de Sologne (Le),comédie,1,FALSE,prose,FALSE,
5780,Boursault (Edme),Nicandres ou les Menteurs qui ne mentent point (Les),comédie,3,FALSE,vers,FALSE,
5382,Corneille (Pierre),Nicomède,tragédie,5,FALSE,vers,FALSE,
5809,Danchet (Antoine),Nitétis,tragédie,5,FALSE,vers,FALSE,
5810,Anonyme,Nitocris,tragédie,5,FALSE,vers,FALSE,
5633,"Brécourt (Guillaume Marcoureau, sieur de Brécourt, dit)",Noce de village (La),comédie,1,FALSE,prose,TRUE,
5634,Du Fresny (Charles),Noce interrompue (La),comédie,1,FALSE,prose,TRUE,
5289,Dorvigny,Noces hussardes (Les) ou Les Noces houzardes,comédie,4,FALSE,prose,FALSE,
5290,Brunet (Pierre-Nicolas),"Noms changés, ou l'Indifférent corrigé (Les)",comédie,3,FALSE,vers,FALSE,30 janvier 1780
5714,Dancourt (Florent Carton dit),Notaire obligeant (Le),comédie,3,FALSE,prose,FALSE,21 octobre 1758
5165,Pellegrin (Simon-Joseph),Nouveau monde (Le),comédie,3,TRUE,vers libres,TRUE,
5016,Legrand (Marc-Antoine),Nouveauté (La),comédie,1,FALSE,prose,TRUE,
5781,"Hauteroche (Noël Lebreton, sieur de)",Nouvellistes (Les),comédie,1,FALSE,prose,FALSE,
5344,Destouches,Obstacle imprévu ou l'Obstacle sans obstacle (L'),comédie,5,FALSE,prose,FALSE,
5383,Voltaire (François-Marie Arouet dit),Octave et le jeune Pompée ou le Triumvirat ou Les Triumvirs,tragédie,5,FALSE,vers,FALSE,18 OCTOBRE 1717
5384,Simonet de Maisonneuve (Louis-Jean-Baptiste),Odmard et Zulna,tragédie,5,FALSE,vers,FALSE,5 juillet 1764
5385,Voltaire (François-Marie Arouet dit),Œdipe,tragédie,5,FALSE,vers,FALSE,2 janvier 1788
5811,La Motte (Antoine Houdar de),Œdipe,tragédie,5,FALSE,vers,FALSE,18 septembre 1718
5812,Corneille (Pierre),Œdipe,tragédie,5,FALSE,vers,FALSE,
5386,Ducis (Jean-François),Œdipe chez Admète,tragédie,5,FALSE,vers,FALSE,
5387,Voltaire (François-Marie Arouet dit),Olympie,tragédie,5,FALSE,vers,FALSE,4 décembre 1778
5573,Voisenon (Claude-Henri de Fusée de),Ombre de Molière (L'),prologue,1,FALSE,vers,FALSE,17 mars 1764
5574,"Brécourt (Guillaume Marcoureau, sieur de Brécourt, dit)",Ombre de Molière (L'),comédie,1,FALSE,prose,TRUE,
5345,La Salle (Adrien-Nicolas),"Oncle et les Tantes, ou Chacun sa folie (L')",comédie,3,FALSE,vers,FALSE,
5575,Dancourt (Florent Carton dit),Opéra de village (L'),comédie,1,FALSE,prose,TRUE,25 NOVEMBRE 1785
5576,Anonyme,Opérateur (L'),comédie,1,FALSE,,TRUE,
5577,Dancourt (Florent Carton dit),Opérateur Barry (L'),comédie,1,TRUE,prose,TRUE,
5578,Brueys (David-Augustin de),Opiniâtre (L'),comédie,3,FALSE,vers,FALSE,
5346,Collin d'Harleville (Jean-François),Optimiste ou l'Homme content de tout (L'),comédie,5,FALSE,vers,FALSE,
5347,Saint-Foix (Germain-François Poullain de),Oracle (L'),comédie,1,FALSE,prose,TRUE,
5579,Moncrif (François-Augustin Paradis de),Oracle de Delphes (L'),comédie,3,FALSE,vers,FALSE,29 mars 1740 (Cour)/ 02 avril 1740 CF
5388,Voltaire (François-Marie Arouet dit),Oreste,tragédie,5,FALSE,vers,FALSE,
5813,"Boyer (Claude, abbé) ; Le Clerc (Michel)",Oreste,tragédie,5,FALSE,vers,FALSE,12 janvier 1750
5814,La Grange-Chancel (François-Joseph de),Oreste et Pylade,tragédie,5,FALSE,vers,FALSE,
5291,Fagan (Barthélemy-Christophe),Originaux (Les) - Troisième partie des Caractères de Thalie,comédie,1,FALSE,prose,TRUE,
5389,Blin de Sainmore (Adrien-Michel-Hyacinthe),Orphanis,tragédie,5,FALSE,vers,FALSE,18 JUILLET 1737
5349,Longueil (Charles-Henri de),Orphelin anglais (L'),drame,3,FALSE,prose,FALSE,25 septembre 1773
5350,Voltaire (François-Marie Arouet dit),Orphelin de la Chine (L'),tragédie,5,FALSE,vers,FALSE,
5113,Bret (Antoine),Orpheline ou le Faux généreux (L'),comédie,3,FALSE,vers,FALSE,
5815,Corneille (Pierre),Othon,tragédie,5,FALSE,vers,FALSE,
5816,Saint-Foix (Germain-François Poullain de),Pandore,comédie,1,FALSE,vers,TRUE,12/6/1743
5292,Legrand (Marc-Antoine),Paniers ou la Vieille précieuse (Les) ou La Vieille Précieuse,comédie,1,FALSE,prose,TRUE,
5817,Pousset de Montauban (Jacques),Panurge ou Les Aventures et le mariage de Panurge,comédie,5,FALSE,,TRUE,
5715,Tristan L'Hermite,Parasite (Le),comédie,5,FALSE,vers,FALSE,
5716,"Launay, De",Paresseux (Le),comédie,3,TRUE,vers,FALSE,
5717,Champmeslé (Charles Chevillet dit),Parisien (Le),comédie,5,FALSE,vers,FALSE,
5017,Dancourt (Florent Carton dit),Parisienne (La),comédie,1,FALSE,prose,FALSE,
5391,Mailhol (Gabriel),Paros,tragédie,5,FALSE,vers,FALSE,
5018,Collé (Charles),Partie de chasse de Henri IV (La),comédie,3,FALSE,prose,FALSE,21 janvier 1754
5718,Pellegrin (Simon-Joseph),Pastor-fido (Le),pastorale héroïque,3,TRUE,vers,FALSE,
5392,Dezède (Nicolas),Paulin et Clairette ou les Deux espiègles,comédie-opéra,2,FALSE,prose,TRUE,
5393,"Claret de Fleurieu (Aglaé Deslacs, comtesse)",Pauline,comédie,2,FALSE,vers,FALSE,5 janvier 1792
5818,Pellegrin (Simon-Joseph),Pélopée,tragédie,5,FALSE,vers,FALSE,2 juillet 1791
5167,Diderot (Denis),Père de famille (Le),comédie - drame,5,FALSE,prose,FALSE,22 janvier 1684
5168,Cérou (Pierre),Père désabusé (Le),comédie,1,FALSE,prose,FALSE,
5719,Pellegrin (Simon-Joseph),Père intéressé ou les Vrais amis (Le),comédie,5,FALSE,vers,FALSE,
5720,Anonyme,Père supposé (Le),comédie,1,FALSE,,FALSE,
5169,Billardon de Sauvigny (Edme-Louis),Persifleur (Le),comédie,3,FALSE,vers,FALSE,
5019,Boissy (Louis de),Péruvienne (La),comédie,5,FALSE,vers libres,FALSE,
5721,Raisin (Jacques),Petit homme de la foire (Le),comédie,1,FALSE,prose,FALSE,
5722,Anonyme,Petit maître de campagne ou le Vicomte de Génicourt (Le),comédie,1,FALSE,prose,FALSE,5 JUIN 1740
5723,Marivaux (Pierre de),Petit-maître corrigé (Le),comédie,3,FALSE,prose,FALSE,
5782,Anonyme,Petits Maîtres d'été (Les),comédie,1,FALSE,prose,FALSE,
5820,Boursault (Edme),Phaéton,comédie,5,FALSE,vers,FALSE,
5395,La Harpe (Jean François de),Pharamond,tragédie,5,FALSE,vers,FALSE,
5821,Cahusac (Louis de),Pharamond,tragédie,5,FALSE,vers,FALSE,
5396,Racine (Jean),Phèdre et Hippolyte ou Phèdre,tragédie,5,FALSE,vers,FALSE,14 août 1765
5170,Legrand (Marc-Antoine),Philanthrope ou l'Ami de tout le monde (Le),comédie,1,FALSE,prose,TRUE,
5171,Fabre d'Églantine (Philippe-François-Nazaire),Philinte de Molière ou la Suite du Misanthrope (Le),comédie,5,FALSE,vers,FALSE,
5397,Châteaubrun (Jean-Baptiste Vivien de),Philoctète,tragédie,5,FALSE,vers,FALSE,
5398,La Harpe (Jean François de),Philoctète,tragédie,3,FALSE,vers,FALSE,
5172,Destouches,Philosophe marié ou le Mari honteux de l'être (Le),comédie,5,FALSE,vers,FALSE,1e mars 1755
5173,Sedaine (Michel-Jean),Philosophe sans le savoir (Le),comédie,5,FALSE,prose,FALSE,16 juin 1783
5293,Palissot de Montenoy (Charles),Philosophes (Les ),comédie,3,FALSE,vers,FALSE,
5783,Destouches (Philippe Néricault dit),Philosophes amoureux (Les),comédie,5,FALSE,vers,FALSE,
5822,Campistron (Jean Galbert de),Phocion,tragédie,5,FALSE,vers,FALSE,2 MAI 1760
5020,"La Montagne (Pierre, baron de)",Physicienne (La),comédie,1,FALSE,vers,FALSE,
5399,Belloy (Pierre Laurent de),Pierre le cruel,tragédie,5,FALSE,vers,FALSE,
5400,Dorat (Claude-Joseph),Pierre le Grand,tragédie,5,FALSE,vers,FALSE,
5635,Corneille (Thomas) ; Donneau de Visé (Jean),Pierre Philosophale (La),comédie,5,FALSE,,TRUE,20 mai 1772
5784,Poisson (Raymond),Pipeurs ou les Femmes coquettes (Les),comédie,5,FALSE,vers,FALSE,1e décembre 1779
5294,Racine (Jean),Plaideurs (Les),comédie,5,FALSE,vers,FALSE,
5174,Marchadier (Abbé),Plaisir (Le),comédie,1,FALSE,vers libres,TRUE,
5823,Legrand (Marc-Antoine),Plutus,comédie,3,FALSE,vers,TRUE,
5724,Lesage (Alain-René),Point d'honneur (Le),comédie,5,FALSE,prose,FALSE,
5826,La Fosse (Antoine de),Polixène,tragédie,5,FALSE,vers,FALSE,
5824,Pellegrin (Simon-Joseph),Polydore,tragédie,5,FALSE,vers,FALSE,
5401,Corneille (Pierre),"Polyeucte, martyr ",tragédie,5,FALSE,vers,FALSE,
5825,Genest (Charles-Claude),Polymneste ou Polymnestre,tragédie,5,FALSE,vers,FALSE,
5175,Boindin (Nicolas),Port de mer (Le),comédie,1,FALSE,prose,TRUE,
5176,Brousse-Desfaucherets (Jean-Louis),Portrait ou le Danger de tout dire (Le),comédie,1,FALSE,vers,FALSE,
5725,Boissy (Louis de),Pouvoir de la sympathie (Le),comédie,3,FALSE,vers,FALSE,
5295,Molière (Jean-Baptiste Poquelin dit),Précieuses ridicules (Les),comédie,1,FALSE,prose,TRUE,
5177,La Chaussée (Pierre-Claude),Préjugé à la mode (Le),comédie,5,FALSE,vers,FALSE,
5178,Marivaux (Pierre de),Préjugé vaincu (Le),comédie,1,FALSE,prose,FALSE,
5179,Fabre d'Églantine (Philippe-François-Nazaire),Présomptueux ou l'Heureux imaginaire (Le),comédie,5,FALSE,vers,FALSE,
5726,Aigueberre (Jean Dumas d'),Prince de Noisy (Le),comédie héroïque,3,TRUE,prose,TRUE,
5021,Molière (Jean-Baptiste Poquelin dit),Princesse d'Élide (La),comédie-ballet,5,TRUE,prose,TRUE,
5180,Parisau (Pierre-Germain),Prix académique (Le),comédie,1,FALSE,vers,FALSE,
5727,Dancourt (Florent Carton dit),Prix de l'arquebuse (Le),comédie,1,FALSE,prose,TRUE,
5728,Fuzelier (Louis),Procès des Sens (Le),comédie,1,FALSE,vers,FALSE,
5181,Poisson (Philippe),Procureur arbitre (Le),comédie,1,FALSE,vers,FALSE,
5636,Anonyme,Provençale (La),comédie,1,FALSE,,FALSE,
5637,"Palaprat (Jean de, sieur de Bigot)",Prude du temps (La),comédie,5,FALSE,vers,FALSE,
5827,Molière (Jean-Baptiste Poquelin dit),Psyché,tragédie,5,TRUE,vers,TRUE,
5638,Guérin d'Estriché (Nicolas-Armand-Martial),Psyché de village (La),comédie,4,TRUE,prose,TRUE,
5402,Rousseau (Jean-Jacques),Pygmalion,scène lyrique,,FALSE,prose,TRUE,
5403,Poinsinet de Sivry (Louis),Pygmalion,comédie,1,FALSE,prose,FALSE,
5404,Mauduit-Larive (Jean),Pyrame et Thisbé,scène lyrique,2,FALSE,prose,TRUE,30 octobre 1775
5828,Pradon (Nicolas),Pyrame et Thisbé,comédie,5,FALSE,vers,FALSE,13 décembre 1760
5405,Crébillon (Prosper Jolyot de),Pyrrhus,tragédie,5,FALSE,vers,FALSE,2 juin 1783
5406,Bret (Antoine) ; Godard d'Aucour (Claude) ; Villaret (Claude),Quartier d'hiver (Le),comédie,1,FALSE,prose,TRUE,
5182,Molé (François-René),Quiproquo (Le),comédie,1,FALSE,prose,FALSE,22 avril 1726
5829,La Fontaine (Jean de),Ragotin ou le Roman comique,comédie,5,FALSE,vers,FALSE,4 décembre 1744
5729,"La Grange (ou Lagrange, Nicolas [de])",Rajeunissement inutile (Le),comédie,3,FALSE,vers,TRUE,
5639,"Robbe, Jacques",Rapinière ou l'intéressé (La),comédie,5,FALSE,vers,FALSE,
5407,Sedaine (Michel-Jean),"Raymond V, comte de Toulouse ou le Troubadour",comédie héroïque,5,FALSE,prose,FALSE,
5023,Du Fresny (Charles),Réconciliation normande (La),comédie,5,FALSE,vers,FALSE,
5024,Desfontaines (François-Georges),Réduction de Paris (La),pièce héroïque,3,FALSE,prose,FALSE,22 septembre 1789
5408,Dorat (Claude-Joseph),Régulus,tragédie,3,FALSE,vers,FALSE,
5830,Pradon (Nicolas),Régulus,tragédie,5,FALSE,vers,FALSE,
5785,L'Affichard (Thomas); Allainval (Léonor-Jean-Christine Soulas d'),Réjouissances publiques ou le Gratis (Les),comédie,1,FALSE,prose,TRUE,31 juillet 1773
5831,Dancourt (Florent Carton dit),Renaud et Armide,comédie,1,FALSE,prose,TRUE,
5640,L'Affichard (Thomas),"Rencontre imprévue, ou la Surprise des amants (La)",comédie,3,FALSE,prose,FALSE,
5730,La Fontaine (Jean de),Rendez-vous (Le),comédie,1,FALSE,vers,FALSE,
5731,Baron (Michel Boyron dit),Rendez-vous des Tuileries ou le Coquet trompé (Le),comédie,3,TRUE,prose,TRUE,
5183,André-Murville (Pierre-Nicolas),Rendez-vous du mari ou le Mari à la mode (Le),comédie,1,FALSE,vers,FALSE,
5184,Fagan (Barthélemy-Christophe),Rendez-vous ou l'Amour supposé (Le),comédie,1,FALSE,vers,FALSE,
5641,Baron (Michel Boyron dit),Répétition (La),comédie,1,FALSE,,FALSE,
5297,"Bièvre (François-Georges Maréchal, marquis de)",Réputations (Les),comédie,5,FALSE,vers,FALSE,
5025,Forgeot (Nicolas-Julien),Ressemblance (La),comédie,3,FALSE,vers,FALSE,
5732,Voisenon (Claude-Henri de Fusée de),Retour de l'Ombre de Molière (Le),comédie,1,FALSE,vers,FALSE,23 janvier 1788
5185,Dancourt (Florent Carton dit),Retour des officiers (Le),comédie,1,FALSE,prose,TRUE,
5186,Ségur (Joseph-Alexandre de),Retour du mari (Le),comédie,1,FALSE,vers,FALSE,
5187,Regnard (Jean-François),Retour imprévu (Le),comédie,1,FALSE,prose,FALSE,
5643,Marivaux (Pierre de),Réunion des amours (La),comédie héroïque,1,FALSE,prose,FALSE,
5733,Poisson (Philippe),Réveil d'Épiménide (Le),comédie,3,TRUE,vers,FALSE,
5188,Carbon de Flins Des Oliviers (Claude-Marie-Louis-Emmanuel),Réveil d'Épiménide à Paris (Le),comédie,1,FALSE,vers,FALSE,
5409,Crébillon (Prosper Jolyot de),Rhadamiste et Zénobie,tragédie,5,FALSE,vers,FALSE,
5410,Durosoy (Barnabé Farmian),Richard III,tragédie,5,FALSE,vers,FALSE,
5411,Laignelot (Joseph François),Rienzi,tragédie,5,FALSE,vers,FALSE,23 janvier 1711
